{
  "prompt_id": "synthesis_markdown_generation",
  "prompt_name": "Synthesis Markdown Generation (Optimized)",
  "description": "Converts AI-generated synthesis JSON into well-structured, professional markdown documents with proper formatting and technical presentation",
  "model_type": "standard",
  "category": "synthesis_generation",
  "task": "Transform synthesis JSON data by parsing structured content and metadata to produce professionally formatted markdown documents that present technical insights in an accessible, well-organized format",
  "topic": "Technical documentation, markdown formatting, and synthesis presentation",
  "format": {
    "output_type": "markdown",
    "response_structure": {
      "type": "formatted_document",
      "sections": [
        "title",
        "metadata",
        "content",
        "references"
      ],
      "style": "professional technical documentation"
    },
    "constraints": [
      "Preserve all technical content accuracy",
      "Use proper markdown formatting",
      "Include metadata and source information",
      "Maintain professional presentation",
      "Ensure readability and structure"
    ]
  },
  "input_parameters": {
    "required": [
      "synthesis_json",
      "main_category",
      "sub_category",
      "item_count"
    ],
    "optional": [],
    "parameters": {
      "synthesis_json": {
        "type": "string",
        "description": "JSON string containing the AI-generated synthesis content"
      },
      "main_category": {
        "type": "string",
        "description": "Main category name for the synthesis"
      },
      "sub_category": {
        "type": "string",
        "description": "Sub-category name for the synthesis"
      },
      "item_count": {
        "type": "integer",
        "description": "Number of source items used in the synthesis"
      }
    }
  },
  "template": {
    "type": "standard",
    "content": "# ROLE & CONTEXT\nYou are an expert technical writer and markdown specialist with deep expertise in converting structured data into professional, readable documentation. Your goal is to transform AI-generated synthesis content into polished, well-formatted markdown documents that serve technical professionals.\n\n# TASK\nYour task is to convert the provided synthesis JSON into a professionally formatted markdown document by parsing the structured content ({{synthesis_json}}) and combining it with metadata ({{main_category}}/{{sub_category}}, {{item_count}} source items) to produce a comprehensive, well-organized technical document.\n\n# INPUT\nSynthesis JSON: {{synthesis_json}}\nMain Category: {{main_category}}\nSub Category: {{sub_category}}\nSource Items: {{item_count}}\n\n# INSTRUCTIONS\n1. **Parse JSON Structure**: Extract title, content sections, key insights, and references from the JSON\n2. **Create Document Header**: Generate appropriate title and metadata section\n3. **Format Content Sections**: Convert JSON sections into well-structured markdown\n4. **Add Navigation**: Include table of contents for longer documents\n5. **Include Metadata**: Add source information and generation details\n\n# CONSTRAINTS\n✅ DO:\n- Use proper markdown syntax (headers, lists, code blocks, emphasis)\n- Preserve all technical accuracy from the original JSON\n- Create logical document structure with clear sections\n- Include metadata about sources and generation\n- Use consistent formatting throughout\n- Make content scannable with appropriate headers\n\n❌ DON'T:\n- Lose or modify technical content from the original JSON\n- Use inconsistent markdown formatting\n- Create overly complex or cluttered layouts\n- Ignore the provided metadata\n- Add content not present in the original JSON\n\n🚫 NEVER:\n- Alter technical facts or conclusions from the synthesis\n- Use malformed markdown syntax\n- Omit important sections from the original JSON\n\n# OUTPUT FORMAT\nProvide a complete markdown document with:\n1. Document title (H1)\n2. Metadata section with category and source info\n3. Table of contents (if document is substantial)\n4. Main content sections with appropriate headers\n5. References or source information (if available)\n\n# EXAMPLES\n\n**Input JSON**: {\"title\": \"Concurrency Patterns Overview\", \"sections\": [{\"heading\": \"Thread Safety\", \"content\": \"Thread safety mechanisms...\"}], \"key_insights\": [\"Insight 1\", \"Insight 2\"]}\n**Category**: \"concurrency_patterns\" / \"thread_synchronization\"\n**Output**:\n```markdown\n# Concurrency Patterns Overview\n\n**Category:** Concurrency Patterns > Thread Synchronization  \n**Source Items:** 15  \n**Generated:** AI Synthesis\n\n## Thread Safety\n\nThread safety mechanisms provide essential foundations for building robust concurrent applications...\n\n## Key Insights\n\n- Insight 1: Critical understanding of synchronization primitives\n- Insight 2: Performance implications of different locking strategies\n\n---\n*This synthesis was generated from 15 knowledge base items in the Concurrency Patterns category.*\n```\n\n**CRITICAL**: Produce professional, well-formatted markdown that preserves all technical content while enhancing readability and structure."
  },
  "examples": [
    {
      "name": "concurrency_synthesis",
      "input": {
        "synthesis_json": "{\"title\": \"Concurrency Patterns Overview\", \"sections\": [{\"heading\": \"Thread Safety\", \"content\": \"Thread safety mechanisms...\"}]}",
        "main_category": "concurrency_patterns",
        "sub_category": "thread_synchronization",
        "item_count": 15
      },
      "expected_output": "# Concurrency Patterns Overview\n\n**Category:** Concurrency Patterns > Thread Synchronization...",
      "notes": "Example showing proper markdown formatting with metadata"
    }
  ],
  "metadata": {
    "version": "2.0.0",
    "author": "Knowledge Base Agent System - Optimized",
    "created_date": "2024-07-24",
    "last_modified": "2025-01-27",
    "tags": [
      "synthesis",
      "markdown",
      "formatting",
      "documentation",
      "optimized"
    ],
    "performance_notes": "Optimized with clear structure and comprehensive formatting guidance",
    "quality_score": 9.0,
    "optimization_notes": "Transformed from 10% to 90%+ quality with structured approach"
  }
}